{
  "$generated": false,
  "$source": "manual",
  "$schema": "./geopolitical-entities.schema.json",
  "$note": "HAND-ROLLED catalog of supranational groupings — continents, sub-continents, regions, economic/political/military unions and agreements. No upstream source (CLDR/IANA/ISO don't ship this kind of M:M data), so this file is maintained by humans and lives ALONGSIDE the pipeline-generated catalogs in contracts/geo/. Contains 59 entries spanning 23 GeopoliticalEntityType values across 4 categories: General Geopolitical (Continent/SubContinent/GeopoliticalRegion), Economic (FreeTradeAgreement/CustomsUnion/CommonMarket/EconomicUnion/MonetaryUnion/BilateralInvestmentTreaty/DevelopmentAgreement/ResourceSharingAgreement), Political (PoliticalUnion/HumanRightsAgreement/EnvironmentalAgreement/GovernanceAndCooperationAgreement/PeaceTreaty/DemocracyPromotionAgreement), Military (MilitaryAlliance/ArmsControlAgreement/StatusOfForcesAgreement/PeacekeepingAgreement/SecurityCooperationAgreement/NonAggressionPact). countryISO31661Alpha2Codes is the M:M forward edge — Tier 2 builder computes Country.geopoliticalEntityShortCodes as the inverse-nav. UN list is the full 193 member states; BRICS includes the 2024 expansion (EG/ET/IR/SA/AE). Update `lastEditedAt` when entries change.",
  "catalogVersion": "0.0.2",
  "lastEditedAt": "2026-05-19",
  "entries": [
    {
      "shortCode": "AF",
      "name": "Africa",
      "type": "Continent",
      "countryISO31661Alpha2Codes": ["DZ","AO","BJ","BW","BF","BI","CV","CM","CF","TD","KM","CG","CD","CI","DJ","EG","GQ","ER","SZ","ET","GA","GM","GH","GN","GW","IO","KE","LS","LR","LY","MG","MW","ML","MR","MU","YT","MA","MZ","NA","NE","NG","RE","RW","SH","ST","SN","SC","SL","SO","ZA","SS","SD","TZ","TG","TN","UG","EH","ZM","ZW"]
    },
    {
      "shortCode": "AN",
      "name": "Antarctica",
      "type": "Continent",
      "countryISO31661Alpha2Codes": ["AQ","BV","TF"]
    },
    {
      "shortCode": "AS",
      "name": "Asia",
      "type": "Continent",
      "countryISO31661Alpha2Codes": ["AF","AM","AZ","BH","BD","BT","BN","KH","CN","CY","GE","HK","IN","ID","IR","IQ","IL","JP","JO","KZ","KW","KG","LA","LB","MO","MY","MV","MN","MM","NP","KP","OM","PK","PS","PH","QA","RU","SA","SG","KR","LK","SY","TW","TJ","TH","TL","TR","TM","AE","UZ","VN","YE"]
    },
    {
      "shortCode": "EU",
      "name": "Europe",
      "type": "Continent",
      "countryISO31661Alpha2Codes": ["AL","AD","AT","AX","BY","BE","BA","BG","HR","CZ","DK","EE","FO","FI","FR","DE","GI","GR","GG","HU","IS","IE","IM","IT","JE","LV","LI","LT","LU","MT","MD","MC","ME","NL","MK","NO","PL","PT","RO","SM","RS","SK","SI","ES","SJ","SE","CH","UA","GB","VA","XK"]
    },
    {
      "shortCode": "NA",
      "name": "North America",
      "type": "Continent",
      "countryISO31661Alpha2Codes": ["AI","AG","AW","BS","BB","BZ","BM","BQ","VG","CA","KY","CR","CU","CW","DM","DO","SV","GL","GD","GP","GT","HT","HN","JM","MQ","MX","MS","NI","PA","PR","BL","KN","LC","MF","PM","VC","SX","TT","TC","US","VI"]
    },
    {
      "shortCode": "OC",
      "name": "Oceania",
      "type": "Continent",
      "countryISO31661Alpha2Codes": ["AS","AU","CX","CC","CK","FJ","PF","GU","HM","KI","MH","FM","NR","NC","NZ","NU","NF","MP","PW","PG","PN","WS","SB","TK","TO","TV","UM","VU","WF"]
    },
    {
      "shortCode": "SA",
      "name": "South America",
      "type": "Continent",
      "countryISO31661Alpha2Codes": ["AR","BO","BR","CL","CO","EC","FK","GF","GY","PY","PE","GS","SR","UY","VE"]
    },
    {
      "shortCode": "ARAB",
      "name": "Arabian Peninsula",
      "type": "SubContinent",
      "countryISO31661Alpha2Codes": ["BH","KW","OM","QA","SA","AE","YE"]
    },
    {
      "shortCode": "CAM",
      "name": "Central America",
      "type": "SubContinent",
      "countryISO31661Alpha2Codes": ["BZ","CR","SV","GT","HN","NI","PA"]
    },
    {
      "shortCode": "CAS",
      "name": "Central Asia",
      "type": "SubContinent",
      "countryISO31661Alpha2Codes": ["KZ","KG","TJ","TM","UZ"]
    },
    {
      "shortCode": "EAS",
      "name": "East Asia",
      "type": "SubContinent",
      "countryISO31661Alpha2Codes": ["CN","HK","JP","KP","KR","MO","MN","TW"]
    },
    {
      "shortCode": "INDS",
      "name": "Indian Subcontinent",
      "type": "SubContinent",
      "countryISO31661Alpha2Codes": ["BD","BT","IN","MV","NP","PK","LK"]
    },
    {
      "shortCode": "SCAN",
      "name": "Scandinavia",
      "type": "SubContinent",
      "countryISO31661Alpha2Codes": ["DK","NO","SE"]
    },
    {
      "shortCode": "SEA",
      "name": "Southeast Asia",
      "type": "SubContinent",
      "countryISO31661Alpha2Codes": ["BN","KH","ID","LA","MY","MM","PH","SG","TH","TL","VN"]
    },
    {
      "shortCode": "BALK",
      "name": "Balkans",
      "type": "GeopoliticalRegion",
      "countryISO31661Alpha2Codes": ["AL","BA","BG","HR","ME","MK","RO","RS","SI","XK"]
    },
    {
      "shortCode": "BALT",
      "name": "Baltic States",
      "type": "GeopoliticalRegion",
      "countryISO31661Alpha2Codes": ["EE","LV","LT"]
    },
    {
      "shortCode": "BENE",
      "name": "Benelux",
      "type": "GeopoliticalRegion",
      "countryISO31661Alpha2Codes": ["BE","LU","NL"]
    },
    {
      "shortCode": "CARIB",
      "name": "Caribbean",
      "type": "GeopoliticalRegion",
      "countryISO31661Alpha2Codes": ["AI","AG","AW","BS","BB","BQ","VG","KY","CU","CW","DM","DO","GD","GP","HT","JM","MQ","MS","PR","BL","KN","LC","MF","VC","SX","TT","TC","VI"]
    },
    {
      "shortCode": "LATAM",
      "name": "Latin America",
      "type": "GeopoliticalRegion",
      "countryISO31661Alpha2Codes": ["AR","BZ","BO","BR","CL","CO","CR","CU","DO","EC","SV","GF","GT","GY","HT","HN","MX","NI","PA","PY","PE","PR","SR","UY","VE"]
    },
    {
      "shortCode": "MENA",
      "name": "Middle East and North Africa",
      "type": "GeopoliticalRegion",
      "countryISO31661Alpha2Codes": ["DZ","BH","EG","IR","IQ","IL","JO","KW","LB","LY","MA","OM","PS","QA","SA","SY","TN","TR","AE","EH","YE"]
    },
    {
      "shortCode": "NORD",
      "name": "Nordic Countries",
      "type": "GeopoliticalRegion",
      "countryISO31661Alpha2Codes": ["AX","DK","FO","FI","GL","IS","NO","SE"]
    },
    {
      "shortCode": "SAHEL",
      "name": "Sahel",
      "type": "GeopoliticalRegion",
      "countryISO31661Alpha2Codes": ["BF","TD","ER","ML","MR","NE","SN","SD"]
    },
    {
      "shortCode": "SSA",
      "name": "Sub-Saharan Africa",
      "type": "GeopoliticalRegion",
      "countryISO31661Alpha2Codes": ["AO","BJ","BW","BF","BI","CV","CM","CF","TD","KM","CG","CD","CI","DJ","GQ","ER","SZ","ET","GA","GM","GH","GN","GW","KE","LS","LR","MG","MW","ML","MR","MU","MZ","NA","NE","NG","RW","SH","ST","SN","SC","SL","SO","ZA","SS","TZ","TG","UG","ZM","ZW"]
    },
    {
      "shortCode": "AFTA",
      "name": "ASEAN Free Trade Area",
      "type": "FreeTradeAgreement",
      "countryISO31661Alpha2Codes": ["BN","KH","ID","LA","MY","MM","PH","SG","TH","VN"]
    },
    {
      "shortCode": "CPTPP",
      "name": "Comprehensive and Progressive Agreement for Trans-Pacific Partnership",
      "type": "FreeTradeAgreement",
      "countryISO31661Alpha2Codes": ["AU","BN","CA","CL","JP","MY","MX","NZ","PE","SG","VN"]
    },
    {
      "shortCode": "RCEP",
      "name": "Regional Comprehensive Economic Partnership",
      "type": "FreeTradeAgreement",
      "countryISO31661Alpha2Codes": ["AU","BN","KH","CN","ID","JP","KR","LA","MY","MM","NZ","PH","SG","TH","VN"]
    },
    {
      "shortCode": "USMCA",
      "name": "United States-Mexico-Canada Agreement",
      "type": "FreeTradeAgreement",
      "countryISO31661Alpha2Codes": ["CA","MX","US"]
    },
    {
      "shortCode": "EUCU",
      "name": "European Union Customs Union",
      "type": "CustomsUnion",
      "countryISO31661Alpha2Codes": ["AD","AT","BE","BG","HR","CY","CZ","DK","EE","FI","FR","DE","GR","HU","IE","IT","LV","LT","LU","MT","MC","NL","PL","PT","RO","SK","SI","SM","ES","SE","TR"]
    },
    {
      "shortCode": "SACU",
      "name": "Southern African Customs Union",
      "type": "CustomsUnion",
      "countryISO31661Alpha2Codes": ["BW","SZ","LS","NA","ZA"]
    },
    {
      "shortCode": "EEA",
      "name": "European Economic Area",
      "type": "CommonMarket",
      "countryISO31661Alpha2Codes": ["AT","BE","BG","HR","CY","CZ","DK","EE","FI","FR","DE","GR","HU","IS","IE","IT","LV","LI","LT","LU","MT","NL","NO","PL","PT","RO","SK","SI","ES","SE"]
    },
    {
      "shortCode": "MERCOSUR",
      "name": "Southern Common Market (Mercosur)",
      "type": "CommonMarket",
      "countryISO31661Alpha2Codes": ["AR","BO","BR","CL","CO","EC","GY","PY","PE","SR","UY"]
    },
    {
      "shortCode": "EAEU",
      "name": "Eurasian Economic Union",
      "type": "EconomicUnion",
      "countryISO31661Alpha2Codes": ["AM","BY","KZ","KG","RU"]
    },
    {
      "shortCode": "EZ",
      "name": "Eurozone",
      "type": "MonetaryUnion",
      "countryISO31661Alpha2Codes": ["AD","AT","BE","HR","CY","EE","FI","FR","DE","GR","IE","IT","LV","LT","LU","MT","MC","ME","NL","PT","SM","SK","SI","ES","VA"]
    },
    {
      "shortCode": "ECCU",
      "name": "Eastern Caribbean Currency Union",
      "type": "MonetaryUnion",
      "countryISO31661Alpha2Codes": ["AI","AG","DM","GD","MS","KN","LC","VC"]
    },
    {
      "shortCode": "WAEMU",
      "name": "West African Economic and Monetary Union",
      "type": "MonetaryUnion",
      "countryISO31661Alpha2Codes": ["BJ","BF","CI","GW","ML","NE","SN","TG"]
    },
    {
      "shortCode": "CEMAC",
      "name": "Central African Economic and Monetary Community",
      "type": "MonetaryUnion",
      "countryISO31661Alpha2Codes": ["CM","CF","TD","CG","GQ","GA"]
    },
    {
      "shortCode": "EUR",
      "name": "European Union",
      "type": "PoliticalUnion",